{
  "schema": 1,
  "comment": "Written by make dependency-review RECORD=1 (scripts/kit/dependency-review.mjs) from the registries; make dependency-policy-check compares the checkout with it without a network.",
  "reviewed": "2026-10-11T05:39:41.400Z",
  "locks": [
    {
      "lock": "package-lock.json",
      "sha256": "fafd0bfd087cf851fde8fdcecd55011c651f3f82ec10b53f4cee8e53bc67ed6c",
      "advisories": []
    },
    {
      "lock": "packages/fixture-php/composer.lock",
      "sha256": "27e91f2489524c42fc51dd637f0c06c29ae376ce9f21322ed24e61716c8fb92d",
      "advisories": []
    },
    {
      "lock": "packages/fixture-python/pylock.toml",
      "sha256": "55b765afbfb9f7552b3093050820ade2914d21ea4de792fb376a3b25da018f0b",
      "advisories": []
    },
    {
      "lock": "packages/fixture-go/go.sum",
      "sha256": "0bc3ed6c0782aa9090e414e133f44c5f4cb8bc2ff942b89fc3298c52eee332fd",
      "advisories": []
    },
    {
      "lock": "packages/fixture-rust/Cargo.lock",
      "sha256": "e486cf7de06aee527fa073daa694335e7bf0b4d39e502a1119bb7bddb06b41aa",
      "advisories": []
    }
  ],
  "dependencies": [
    {
      "ecosystem": "npm",
      "manifest": "package.json",
      "package": "is-number",
      "version": "7.0.0",
      "latest": "7.0.0"
    },
    {
      "ecosystem": "npm",
      "manifest": "packages/fixture-lib/package.json",
      "package": "semver",
      "version": "7.6.0",
      "latest": "7.6.0"
    },
    {
      "ecosystem": "composer",
      "manifest": "packages/fixture-php/composer.json",
      "package": "psr/log",
      "version": "3.0.2",
      "latest": "3.0.2"
    },
    {
      "ecosystem": "pypi",
      "manifest": "packages/fixture-python/pylock.toml",
      "package": "click",
      "version": "8.1.7",
      "latest": "8.1.7"
    },
    {
      "ecosystem": "pypi",
      "manifest": "packages/fixture-python/pyproject.toml",
      "package": "setuptools",
      "version": "84.0.0",
      "latest": "84.0.0"
    },
    {
      "ecosystem": "go",
      "manifest": "packages/fixture-go/go.mod",
      "package": "github.com/google/uuid",
      "version": "v1.6.0",
      "latest": "v1.6.0"
    }
  ],
  "vcs": [
    {
      "lock": "packages/fixture-python/pylock.toml",
      "package": "pip-tools",
      "url": "https://github.com/jazzband/pip-tools",
      "requestedRevision": "7.4.1",
      "commitId": "60ebdf5d1625cb63d0b94326035e0aa209659f4d"
    }
  ]
}
